{
  "schema_version": "c-memory-reliance-record-0.1",
  "record_type": "memory_reliance_record",
  "record_id": "memory-reliance-42",
  "created_at": "2026-08-27T00:15:00+02:00",
  "memory_item_ref": {"artifact_id":"memory-item:service-endpoint","version":"0.1","hash":"50f4bdd7ded4579ff9624fd783cb3b036faf1ed6c864c2c86077542c6ba72cbc"},
  "admission_record_ref": {"artifact_id":"memory-admission:service-endpoint","version":"0.1","hash":"b9515e4b7f3a4909d4d4ba2a30c1939a2be31770f50d1e0157f26df2ff51f399"},
  "current_task_ref": {"artifact_id":"task-contract:deploy-42","version":"0.1","hash":"7c9e3a69099dcace4686cc3b279f521586674593735299f9496af5bd83a3c0ba"},
  "current_purpose": "Use the remembered staging endpoint only to prepare a reversible deployment check.",
  "current_role": "bounded-deployment-agent",
  "current_authority_ref": {"artifact_id":"CLI_AGENT_PERMISSION_GRANT:grant-42","version":"0.1","hash":"c4afc103f42b7e0a1d0c2b76eb28d639516b1edf16395b652f8216b90e5ef968"},
  "provenance_state": "VERIFIED",
  "freshness_state": "AGING",
  "revocation_state": "NOT_REVOKED",
  "consent_state": "NOT_REQUIRED",
  "conflict_state": "CLEAR",
  "contamination_state": "CLEAR",
  "consequence_class": "REVERSIBLE_ACTION",
  "verdict": "USE_WITH_LIMITS",
  "use_limits": ["verify endpoint against current registry before any external call","do not promote derived output into durable memory"],
  "previous_reliance_record_ref": null,
  "witness_chain_head": "2b6a7458b98569bd1219f9203b5918157dae6ab6639543c3d29757cc20cc1f8a",
  "claim_boundary": "Admission into durable memory is not current permission to use it. This record authorizes only the declared purpose, role, scope and consequence class."
}
